<?xml version="1.0" encoding="UTF-8" standalone="yes"?>
<CakeEvent xmlns="http://www.example.org/CakeEvent" xmlns:xsi="http://www.w3.org/2001/XMLSchema-instance" id="1" createdAt="03.09.2010 15:01:51" solved="true" solverStatus="SOLVER_OK" xsi:noNamespaceSchemaLocation="/Schema/CakeEvent.xsd">
    <name>Kuchen</name>
    <autor>CHristian MÃ¼ller</autor>
    <description>OR Kuchen backen Aufgabe</description>
    <capital>400.0</capital>
    <ingredients>
        <ingredient id="0">
            <name>Mehl</name>
            <unit>kg</unit>
            <price>1.5</price>
            <stock>600.0</stock>
        </ingredient>
        <ingredient id="1">
            <name>Zucker</name>
            <unit>kg</unit>
            <price>2.5</price>
            <stock>250.0</stock>
        </ingredient>
        <ingredient id="2">
            <name>Milch</name>
            <unit>Liter</unit>
            <price>1.2</price>
            <stock>300.0</stock>
        </ingredient>
        <ingredient id="3">
            <name>Eier</name>
            <unit>Stck</unit>
            <price>0.2</price>
            <stock>2400.0</stock>
        </ingredient>
    </ingredients>
    <recipes>
        <recipe id="0">
            <name>Kuchen 1</name>
            <description>Beschreibung des Kuchen 1</description>
            <instructions>Anleitung zum Erstellen eines Kuchen 1</instructions>
            <recipe_ingredient ingredient_id="0" amount="2.0"/>
            <recipe_ingredient ingredient_id="1" amount="0.5"/>
            <recipe_ingredient ingredient_id="2" amount="1.0"/>
            <recipe_ingredient ingredient_id="3" amount="6.0"/>
            <sales_price>6.0</sales_price>
            <production_lwb>0.0</production_lwb>
            <production_upb>INF</production_upb>
        </recipe>
        <recipe id="1">
            <name>Kuchen 2</name>
            <description>Beschreibung des Kuchen 2</description>
            <instructions>Anleitung zum Erstellen eines Kuchen 2</instructions>
            <recipe_ingredient ingredient_id="0" amount="1.0"/>
            <recipe_ingredient ingredient_id="1" amount="1.0"/>
            <recipe_ingredient ingredient_id="2" amount="0.5"/>
            <recipe_ingredient ingredient_id="3" amount="9.0"/>
            <sales_price>8.0</sales_price>
            <production_lwb>0.0</production_lwb>
            <production_upb>INF</production_upb>
        </recipe>
    </recipes>
    <solution solved="true" solvedAt="Sep 25, 2014  7:28:02 PM" optimal="true" status="optimal">
        <profit>3052.03</profit>
        <used_capital>400.0</used_capital>
        <production recipe_id="0" quantity="174.797"/>
        <production recipe_id="1" quantity="250.407"/>
        <used_ingredient ingredient_id="0" amountStock="600.0" amountBuyed="0.0" CostBuyed="0.0" percentOfCostBuyed="0.0"/>
        <used_ingredient ingredient_id="1" amountStock="250.0" amountBuyed="87.8049" CostBuyed="219.51225" percentOfCostBuyed="54.8780625"/>
        <used_ingredient ingredient_id="2" amountStock="300.0" amountBuyed="0.0" CostBuyed="0.0" percentOfCostBuyed="0.0"/>
        <used_ingredient ingredient_id="3" amountStock="2400.0" amountBuyed="902.439" CostBuyed="180.4878" percentOfCostBuyed="45.12195"/>
    </solution>
</CakeEvent>
